{
  "schema_version": "0.1.0",
  "task_id": "t-5f03",
  "track": "operations",
  "instruction": "检查候选 cand-b17 为什么尚未进入训练交付，并按当前策略处理。若缺少人工决定，请保留依据后提交转交记录。",
  "context": {
    "scope_id": "scope-f145"
  },
  "allowed_tools": [
    "inspect_state",
    "inspect_task",
    "trace_lineage",
    "verify_artifacts",
    "inspect_policy",
    "list_recovery_sources",
    "retry_task",
    "run_pending",
    "restore_artifact",
    "record_escalation",
    "submit_resolution"
  ],
  "budgets": {
    "max_actions": 12,
    "max_context_tokens": 12288,
    "max_output_tokens_per_turn": 1024,
    "max_total_output_tokens": 4096
  },
  "output_contract": "operations-resolution-v0.1"
}
